{
  "$schema": "https://json-schema.org/draft/2020-12/schema",
  "type": "object",
  "required": [
    "schemaVersion",
    "kind",
    "id",
    "version",
    "title",
    "purpose",
    "license",
    "maintainer",
    "stacks",
    "instructions",
    "activation",
    "boundaries",
    "filesystemScope",
    "networkScope",
    "requiredTools",
    "humanApprovalRequirements",
    "requiredControls",
    "skills",
    "inputs",
    "outputs",
    "supportedPlatforms",
    "exampleTasks",
    "knownLimitations"
  ],
  "properties": {
    "schemaVersion": {
      "const": "1"
    },
    "kind": {
      "const": "Agent"
    },
    "id": {
      "type": "string",
      "pattern": "^[a-z][a-z0-9-]*/[a-z][a-z0-9-]*$"
    },
    "version": {
      "type": "string",
      "pattern": "^(0|[1-9][0-9]*)\\.(0|[1-9][0-9]*)\\.(0|[1-9][0-9]*)$"
    },
    "title": {
      "type": "string",
      "minLength": 1
    },
    "purpose": {
      "type": "string",
      "minLength": 1
    },
    "license": {
      "type": "string",
      "minLength": 1
    },
    "maintainer": {
      "type": "object",
      "required": [
        "name",
        "contact"
      ],
      "properties": {
        "name": {
          "type": "string",
          "minLength": 1
        },
        "contact": {
          "type": "string",
          "minLength": 1
        }
      },
      "additionalProperties": false
    },
    "stacks": {
      "type": "array",
      "items": {
        "type": "string",
        "minLength": 1
      }
    },
    "instructions": {
      "type": "string",
      "minLength": 1
    },
    "activation": {
      "type": "object",
      "required": [
        "triggers",
        "nonTriggers"
      ],
      "properties": {
        "triggers": {
          "type": "array",
          "items": {
            "type": "string",
            "minLength": 1
          },
          "minItems": 1
        },
        "nonTriggers": {
          "type": "array",
          "items": {
            "type": "string",
            "minLength": 1
          },
          "minItems": 1
        }
      },
      "additionalProperties": false
    },
    "boundaries": {
      "type": "array",
      "items": {
        "type": "string",
        "minLength": 1
      },
      "minItems": 1
    },
    "filesystemScope": {
      "type": "object",
      "required": [
        "read",
        "write",
        "deny"
      ],
      "properties": {
        "read": {
          "type": "array",
          "items": {
            "type": "string",
            "minLength": 1
          }
        },
        "write": {
          "type": "array",
          "items": {
            "type": "string",
            "minLength": 1
          }
        },
        "deny": {
          "type": "array",
          "items": {
            "type": "string",
            "minLength": 1
          }
        }
      },
      "additionalProperties": false
    },
    "networkScope": {
      "type": "object",
      "required": [
        "mode",
        "destinations",
        "externalWriteAllowed"
      ],
      "properties": {
        "mode": {
          "enum": [
            "none",
            "allowlist"
          ]
        },
        "destinations": {
          "type": "array",
          "items": {
            "type": "string",
            "minLength": 1
          }
        },
        "externalWriteAllowed": {
          "type": "boolean"
        }
      },
      "additionalProperties": false
    },
    "requiredTools": {
      "type": "array",
      "items": {
        "type": "string",
        "minLength": 1
      }
    },
    "humanApprovalRequirements": {
      "type": "array",
      "items": {
        "type": "object",
        "required": [
          "action",
          "reason",
          "behavior"
        ],
        "properties": {
          "action": {
            "type": "string",
            "minLength": 1
          },
          "reason": {
            "type": "string",
            "minLength": 1
          },
          "behavior": {
            "enum": [
              "ask",
              "handoff"
            ]
          }
        },
        "additionalProperties": false
      }
    },
    "requiredControls": {
      "type": "array",
      "items": {
        "enum": [
          "filesystem-scope",
          "network-scope",
          "human-approval-gates"
        ]
      },
      "uniqueItems": true,
      "minItems": 3,
      "maxItems": 3
    },
    "skills": {
      "type": "array",
      "items": {
        "type": "object",
        "required": [
          "kind",
          "id",
          "version"
        ],
        "properties": {
          "kind": {
            "enum": [
              "Skill"
            ]
          },
          "id": {
            "type": "string",
            "pattern": "^[a-z][a-z0-9-]*/[a-z][a-z0-9-]*$"
          },
          "version": {
            "type": "string",
            "pattern": "^(0|[1-9][0-9]*)\\.(0|[1-9][0-9]*)\\.(0|[1-9][0-9]*)$"
          }
        },
        "additionalProperties": false
      }
    },
    "inputs": {
      "type": "array",
      "items": {
        "type": "string",
        "minLength": 1
      },
      "minItems": 1
    },
    "outputs": {
      "type": "array",
      "items": {
        "type": "string",
        "minLength": 1
      },
      "minItems": 1
    },
    "supportedPlatforms": {
      "type": "array",
      "items": {
        "type": "object",
        "required": [
          "host",
          "targetVersion",
          "declaredIntent"
        ],
        "properties": {
          "host": {
            "enum": [
              "codex",
              "claude-code",
              "cursor",
              "gemini-cli"
            ]
          },
          "targetVersion": {
            "type": "string",
            "minLength": 1
          },
          "declaredIntent": {
            "enum": [
              "candidate",
              "supported",
              "unsupported"
            ]
          }
        },
        "additionalProperties": false
      },
      "minItems": 1
    },
    "exampleTasks": {
      "type": "array",
      "items": {
        "type": "string",
        "minLength": 1
      },
      "minItems": 1
    },
    "knownLimitations": {
      "type": "array",
      "items": {
        "type": "string",
        "minLength": 1
      },
      "minItems": 1
    }
  },
  "additionalProperties": false,
  "allOf": [
    {
      "if": {
        "properties": {
          "networkScope": {
            "properties": {
              "mode": {
                "const": "none"
              }
            }
          }
        }
      },
      "then": {
        "properties": {
          "networkScope": {
            "properties": {
              "destinations": {
                "maxItems": 0
              },
              "externalWriteAllowed": {
                "const": false
              }
            }
          }
        }
      }
    }
  ]
}
